account,name,link,keywords,language
@skepteis@skepteis.social,Daniel Probst,https://danielprobst.science,drug discovery drug development cheminformatics ml,en
@physicsteo@mastodon.online,Matteo Cavalleri,https://www.linkedin.com/in/teowaits,compchem-ist former EiC of the Int. Journal of Quantum Chemistry publisher at WILEY simulation geek,en
@bspahh@sciencemastodon.com,Andrew Henry,https://www.linkedin.com/in/andrewhhenry/?originalSubdomain=uk,Computational chemistry drug design biologics modelling,en
@rbhar90@mastodon.social,Bharath Ramsundar,https://rbharath.github.io/,lead Developer of DeepChem. Machine learning for drug discovery small molecule design differentiable physics,en
@ATGarciaSosa@mastodon.social,Alfonso T. Garcia-Sosa,https://hermes.chem.ut.ee/~alfx/index.html,drug design - molecular modeling - medicinal chemistry - computational chemistry - molecular dynamics,en
